Product Name,Price,Units Sold,Location,Product Link
Ice Silk Mesh Modal Cool Sensation Quick Dry Short Sleeve T-Shirt Men Summer Sports Half Sleeve Top Trendy round Neck T-Shirt,$2.59,99,China,//www.lazada.sg/products/pdp-i3426459881.html
【Ship in 24H】High-end Jacquard Ice-feel Short Sleeve/M-5XL big size Ice silk cool shirt men simple plain Short Sleeve shirt plus size Casual loose冰丝短袖,$8.20,0,Singapore,//www.lazada.sg/products/pdp-i3389171086.html
Summer Ice Silk Cool Men's Short Sleeve Shirt Anti-Wrinkle No Ironing Business Formal White Shirt for Men Fashion Urban Style,$39.31,18,Hong Kong,//www.lazada.sg/products/pdp-i3435780626.html
Ice Silk Quick Dry Summer Thin Men's T-Shirt Outdoor Sports Shirt Cool Sensation Simple Match Large Size Casual round Neck Short Sleeve,$2.27,15,China,//www.lazada.sg/products/pdp-i3443970817.html
Ice Silk Vest Men's Loose Lightweight Mesh Breathable Quick Dry Sports Base Shirt Sleeveless T-Shirt Summer Cool Feeling,$1.03,102,China,//www.lazada.sg/products/pdp-i3463632787.html
Ice Silk Men's Short Sleeve T-Shirt Ultra-Thin Quick-Drying Mesh Half Sleeve Cool Sensation Breathable Summer Fashion Tee Shirt,$2.34,16,China,//www.lazada.sg/products/pdp-i3423024766.html
Cool Feeling Modal Short Sleeve T-Shirt Men's Summer Ice Silk round Neck Base Shirt Quick Dry Body Tee Youth Fashion Polyester Fiber,$4.79,478,Hong Kong,//www.lazada.sg/products/pdp-i3049480033.html
Pemon Air Conditioning Suit Men's Fan Clothing Cooling Workwear Outdoor Heat Protection Shirt with Refrigeration Fan Summer,$27.28,3600,China,//www.lazada.sg/products/pdp-i3442187536.html
Ice Silk Hollow out Short Sleeve Knitted Shirt Men's Summer Cool Quick Dry Casual Top Trendy High End Half Sleeve Knitwear,$2.70,0,China,//www.lazada.sg/products/pdp-i3452422439.html
Ice Silk Mesh Short Sleeve T-Shirt Men's Cool Feeling Summer Thin Breathable Quick Dry Large Size Sports Leisure Half Sleeve Body Shirt,$2.32,70,China,//www.lazada.sg/products/pdp-i3457862747.html
HFA Cooling Quarter Zip Polo 220GSM Oversized Tee,$26.90,14,Singapore,//www.lazada.sg/products/pdp-i3434058756.html
Cool Feeling Ice Silk Men's T-Shirt Short Sleeve round Neck Summer Large Size Quick Dry Breathable Base Shirt Bamboo Node Mesh,$2.77,137,China,//www.lazada.sg/products/pdp-i3428391271.html
Quick Dry Ice Silk Loose Casual Short Sleeve T-Shirt for Men Breathable Elastic Sports Top Summer Lightweight round Neck Tee,$3.11,112,China,//www.lazada.sg/products/pdp-i3439363222.html
Ice Silk Short Sleeve T-Shirt Men's Quick Dry Breathable Loose High Elasticity Running Mesh Sports Summer Fitness Clothes,$3.90,305,Hong Kong,//www.lazada.sg/products/pdp-i2873407423.html
Modale Summer T-Shirt Men's Short Sleeve round Neck Base Shirt Cool Feeling Fashionable Casual Wear Youth Slim Fit No Ironing Required,$2.55,607,China,//www.lazada.sg/products/pdp-i3452544907.html
Ice Silk Quick Dry Cool Feeling Short Sleeve T-Shirt Men's round Neck Top Trendy Summer New Style Modal Cotton Half Sleeve Body Shirt,$3.12,6,China,//www.lazada.sg/products/pdp-i3435851884.html
Ice Silk Thin Short Sleeve Men's T-Shirt Pure Color Summer Cool Inner Wear Sweat Shirt Half Sleeve T-Shirt Quick Dry Youth Fashion,$3.71,20,China,//www.lazada.sg/products/pdp-i3425471536.html
Summer Thin Cotton Polo Shirt Men's Short Sleeve T-Shirt Pure Silk Ice Cool Collar Fashionable Youth Quick Dry Polyester Fiber,$3.11,6,China,//www.lazada.sg/products/pdp-i3461832582.html
Loose Ice Silk Men's T-shirt round Neck Short Sleeve Large Size Base Shirt Summer Trendy Cool Feeling Half Sleeve Top,$2.94,0,China,//www.lazada.sg/products/pdp-i2890493871.html
Lightweight Cool Feeling Ice Silk Short Sleeve T-Shirt Women's Summer Sporty Couple Style round Neck Pure Color Base Shirt,$3.50,0,China,//www.lazada.sg/products/pdp-i3447609592.html
Men's Short Sleeve T-Shirt Pure Cotton Ice Silk Cool Feeling Breathable Base Layer Summer Short Shirt Casual round Neck Slim Fit,$3.31,0,China,//www.lazada.sg/products/pdp-i3439199869.html
Men's Breathable Casual Ice Silk T-shirt Quick Dry Summer Thin Half Sleeve Loose Short Sleeve Sportswear Youth Fashion,$7.61,543,China,//www.lazada.sg/products/pdp-i3421292398.html
Men's Ice Silk Short Sleeve T-Shirt Loose Fit Base Layer Shirt Modal Cool Feeling Cotton Body Shirt Casual Summer Top,$3.17,67,China,//www.lazada.sg/products/pdp-i3427247828.html
