Product Name,Price,Units Sold,Location,Product Link
Ice Silk Quick Dry Short Sleeve Running Top Half Zipper Stand Collar Shark Sports T-Shirt Outdoor Summer Training Wear for Men,$3.40,363,China,//www.lazada.sg/products/pdp-i3436035724.html
Ice Silk Bamboo Mesh T-Shirt Men's Short Sleeve Quick-Drying Sweatshirts Half Sleeve Men's Summer Breathable Cool Feeling T-shirt Men's Top,$2.96,26,China,//www.lazada.sg/products/pdp-i3118002228.html
Summer Men's Ice Silk Cool Feeling Loose Ultra-Thin Printed Half Sleeve Shirt Fashionable Youth Pop Style Short Sleeve Casual Shirt,$2.63,209,China,//www.lazada.sg/products/pdp-i3426567072.html
Cool Handsome Men's Casual Ice Silk Short Sleeve Shirt Trendy Brand Youth Popular Slim Fit Summer Fashion White Shirt,$3.24,299,Hong Kong,//www.lazada.sg/products/pdp-i3341308346.html
Ice Silk Men's Shirt Short Sleeve Lightweight Loose Fit Summer Casual Checkered Pattern Cool Feeling Trendy Brand Upperwear,$9.15,0,,//www.lazada.sg/products/pdp-i3442576946.html
Premium Ice Silk Short Sleeve Shirt Men's Casual Patchwork Summer Thin Top Youth Trendy Flat Iron Treatment Cool Feeling,$3.70,20,Hong Kong,//www.lazada.sg/products/pdp-i3339940904.html
Ice Silk Cuban Collar Polo Shirt Short Sleeve V Neck Men's T-Shirt Fashionable High-End Feel Summer Coolness Teenage Casual,$3.05,496,Hong Kong,//www.lazada.sg/products/pdp-i3341182959.html
Exported to Japan Quick-Drying Cool Cold Heat Dissipation Sun Protection Cooling Ice Silk Leisure Short Sleeve T-shirt Tight Compression Tops,$5.54,6,Hong Kong,//www.lazada.sg/products/pdp-i3275163088.html
American Style Fitness Coach Ice Silk Shirt Muscle Men Slim Elastic Long Sleeve Cool Thin Quick Dry Black Casual Sports Shirt,$6.79,6,Hong Kong,//www.lazada.sg/products/pdp-i3435822122.html
Ice Silk Cool Feeling Slim Fit Short Sleeve Business Casual Commuter Shirt No Ironing Required Seamless Technology Three Proof Fabric,$6.78,34,Hong Kong,//www.lazada.sg/products/pdp-i3284683316.html
Summer Ice Silk Cool Men's Short Sleeve Shirt Anti-Wrinkle No Ironing Business Formal White Shirt for Men Fashion Urban Style,$39.31,18,Hong Kong,//www.lazada.sg/products/pdp-i3435780626.html
SHUNAICHI Summer short-sleeved shirt 2024 new fashion cool printed beach casual Hawaiian vacation trend men's cardigan top breathable,$10.84,0,China,//www.lazada.sg/products/pdp-i3460100149.html
XDUnK Youth Trendy Basketball Training T-Shirt Quick Dry Mesh Short Sleeves Loose Fit Summer Cool Sports Shirt for Men,$9.66,95,China,//www.lazada.sg/products/pdp-i1957006141.html
Giordano Men Ice cooling single pocket short sleeve shirt Free Shipping 01045469,$42.90,0,China,//www.lazada.sg/products/pdp-i3404344961.html
Japanese and Korean Single Spring and Summer Men's Thin Cool Casual Shirt Small Plaid Camouflage Trend Top Versatile Lining,$6.81,18,China,//www.lazada.sg/products/pdp-i2886785479.html
Summer Thin Ice Silk Cool Feeling Middle Sleeve Leopard Print Men's Fashionable Shirt Slim Fit No Ironing Required Five Sleeve,$8.01,61,Hong Kong,//www.lazada.sg/products/pdp-i3435760531.html
KEMALOCE Short Sleeve Cycling Base Layer 2023 Cool Mesh Shirts Compression Jacquard Breathable Fabric Sports Undershirts Tight Plain White&Black Sports Shirts,$13.22,20,China,//www.lazada.sg/products/pdp-i2299059302.html
Cool Sensation Ice Silk Short Sleeve Men's Shirt Summer Trend New Chinese Style Stand Collar Light Maturity Seven Sleeve Top,$7.14,122,Hong Kong,//www.lazada.sg/products/pdp-i3324351028.html
Shirt Summer Men's Chiffon Transparent Long Sleeves Shirt Smooth Drape Cool Silm Fit General Loose plus Size,$24.90,12,China,//www.lazada.sg/products/pdp-i3299999684.html
Summer New Ice Silk Sports Shirt Fashion Outdoor Casual Lightweight Breathable Cool High Elasticity UV Protection,$7.40,0,Hong Kong,//www.lazada.sg/products/pdp-i3305249301.html
Maden American Casual Long Sleeve Men's Shirt Ice Silk Drape Cool Feeling Breathable Cleanfit Black Spring Summer Shirt,$26.15,6,Hong Kong,//www.lazada.sg/products/pdp-i3435794241.html
Lyocell Tencel Short-Sleeved Shirt Men's Summer Thin Cool Breathable Work Clothes Shirt Japanese Style Loose Casual Jacket,$31.66,156,China,//www.lazada.sg/products/pdp-i3086656089.html
Outdoor Sports UV Protection Cool Feeling T-Shirt Men Women Spring Summer UPF200+ High Collar Ice Sensation Long Sleeve Top,$16.51,78,China,//www.lazada.sg/products/pdp-i3398895734.html
7allen Ice Cooling Dri Fit Short Sleeve T-shirt | Quick Drying Running Workout Shirt | Casual Round Neck Sports Tee,$20.80,0,Singapore,//www.lazada.sg/products/pdp-i3263269100.html
Summer Breathable Cotton T-Shirt Men Women Long Staple Short Sleeve Base Shirt Quick Dry Anti UV Reflective Night Vision Cool Feeling,$13.82,0,China,//www.lazada.sg/products/pdp-i3436446528.html
Cool Ice Silk Short Sleeve Shirt Cuban Collar Half Sleeve Hawaii Thai Style Vacation Beach Youth Fashion Summer Shirt for Men,$16.01,0,Hong Kong,//www.lazada.sg/products/pdp-i3284571686.html
Ice Silk Short Sleeve Shirt Men's Casual Anti-Wrinkle Cuban Collar Half Sleeve Cool Feeling Youthful Trendy Pure Color Summer Shirt,$9.95,48,Hong Kong,//www.lazada.sg/products/pdp-i3462569388.html
Lightweight Summer Ice Silk Short Sleeve Shirt Men's Hawaii Vacation Loose Beach Casual Floral Print Shirt Cool Sensation Thin Fabric,$5.54,6,Hong Kong,//www.lazada.sg/products/pdp-i3284882094.html
Giordano Men Ice cooling half placket short sleeve shirt Free Shipping 01045463,$45.90,0,China,//www.lazada.sg/products/pdp-i3404443472.html
Quick Dry Ice Silk Loose Fit Short Sleeve Men's T-Shirt Breathable Mesh Large Size Running Training Top for Summer Heat Relief,$4.19,21,China,//www.lazada.sg/products/pdp-i3458939832.html
Lilanz Slim Fit Short Sleeve Ice Silk Shirt Business Casual Summer Thin Men's Fashion Striped Top Cool Comfortable Shirt,$47.51,36,Hong Kong,//www.lazada.sg/products/pdp-i3435787399.html
New Chinese Style Ice Silk Short Sleeve Shirt Thin Satin Fabric Hanfu Summer Cool Stand Collar Men's Fashion Casual Shirt,$27.98,6,Hong Kong,//www.lazada.sg/products/pdp-i3288541688.html
True Weave Cool Sensation Short Sleeve Shirt Unisex Summer New Style Casual Fashion Brand Jeanswest Nylon Spandex Blend,$33.14,4800,Hong Kong,//www.lazada.sg/products/pdp-i3462477811.html
ELI【North Plum】Lanxim Lyocell Blended Spring Summer Loose Casual Long Sleeve Shirt Cool Fashion Urban Standard Fit,$49.93,1200,Hong Kong,//www.lazada.sg/products/pdp-i3451323539.html
Lormen High-end Iron-free Ice Silk Short Sleeve Shirt Men's Business Casual Cool Comfortable Thin Anti-wrinkle Shirt Fashion,$25.69,1200,Hong Kong,//www.lazada.sg/products/pdp-i3462581216.html
Jeanswest Men's Black Ice Silk Cool Feeling Short Sleeve Shirt Summer New Arrival Casual Loose Fit Printed Knitted Polyester,$18.90,54,Hong Kong,//www.lazada.sg/products/pdp-i3462472931.html
Unisex Breathable Air Conditioning Work Shirt Summer Anti-Uv Fan Cooling Clothing Reflective Belt Long Sleeve Cotton Blend Shirt,$12.81,600,Hong Kong,//www.lazada.sg/products/pdp-i3462458831.html
Jeanswest Life Men's Ice Silk Short Sleeve Shirt Quick Dry Cool Feeling Summer Fashionable Top Dad Clothes Polyester Blend,$18.86,30,Hong Kong,//www.lazada.sg/products/pdp-i3462404859.html
Summer Fashion Dragon Pattern Printed Ice Silk Short Sleeve Shirt Men's Seamless Half Sleeve Stand Collar Cool Polyester Blend,$26.60,0,Hong Kong,//www.lazada.sg/products/pdp-i3052120489.html
Wear-Resistant Air Conditioning Work Shirt Men's Style without Accessories Deep Blue Reflective Belt Cooling Fan Uniform,$15.29,204,Hong Kong,//www.lazada.sg/products/pdp-i3462496827.html
2025 Summer New Ice Silk Short Sleeve Cool Feeling T Men's Loose Fit Trendy Quick-Dry Shirt Versatile Sports Plus Size T Men's T-shirt JIKK,$2.67,0,China,//www.lazada.sg/products/pdp-i3345321744.html
Ice Silk Vest Men's Loose Lightweight Mesh Breathable Quick Dry Sports Base Shirt Sleeveless T-Shirt Summer Cool Feeling,$1.03,102,China,//www.lazada.sg/products/pdp-i3463632787.html
Ice Silk Cool Feeling T-Shirt Men's Summer Black Elastic Quick Dry Large Size Half Sleeve Loose Cool Short Sleeve Men's Shirt,$3.12,0,China,//www.lazada.sg/products/pdp-i3434516223.html
Ice Silk Hollow out Short Sleeve Knitted Shirt Men's Summer Cool Quick Dry Casual Top Trendy High End Half Sleeve Knitwear,$2.70,0,China,//www.lazada.sg/products/pdp-i3452422439.html
Summer Men's Outdoor Mountaineering Men's Quick Drying Clothes Large and Small Size Men's Quick-Drying Sun Protection Cool Shirt Hiking Leisure,$14.11,126,China,//www.lazada.sg/products/pdp-i2085234373.html
New Ice Silk Men's Short Sleeve Summer Thin T-Shirt Cool Feeling Base Shirt Quick Dry Gradient Half Sleeve Top Youth Fashion,$3.12,12,Hong Kong,//www.lazada.sg/products/pdp-i3435720605.html
Ice Silk Mesh Base Shirt Men's Short Sleeve T-Shirt Quick Dry Slim Fit Youth Fashion Summer Casual round Neck Top,$3.22,35,China,//www.lazada.sg/products/pdp-i3435184868.html
Men's Ice Silk Short Sleeve T-Shirt Loose Fit Base Layer Shirt Modal Cool Feeling Cotton Body Shirt Casual Summer Top,$3.17,67,China,//www.lazada.sg/products/pdp-i3427247828.html
Ice Silk Mesh Modal Cool Sensation Quick Dry Short Sleeve T-Shirt Men Summer Sporty Half Sleeve Top Trendy round Neck T-Shirt,$3.03,3000,Hong Kong,//www.lazada.sg/products/pdp-i3340279331.html
Summer Lightweight Casual round Neck Loose Ice Silk Mesh Short Sleeve Quick Dry Breathable Sport Thin Cool T-Shirt Trendy,$5.77,0,,//www.lazada.sg/products/pdp-i3461671298.html
Ice Silk Cool Feeling Short Sleeve T-Shirt Men's Casual Sports Fitness Breathable Quick Dry Shirt Summer New Arrival TUCANO,$3.68,14,China,//www.lazada.sg/products/pdp-i3440409276.html
Men's Ice Silk Mesh Hollow Cooling Vest Slim Fit Sporty Breathable Fitness Base Shirt Summer Thin Style Home round Neck Knitted Vest,$2.93,602,China,//www.lazada.sg/products/pdp-i2887217968.html
Playboy Summer Ice Silk Loose Half Sleeve T-Shirt Men's Base Shirt Trendy Brand Creative Print Cool Feeling Polyester Youth Fashion,$6.26,7,China,//www.lazada.sg/products/pdp-i3441928152.html
High-End Modal Men's Short Sleeve T-Shirt Ice Silk Thin Breathable Summer Shirt Youth Fashion Cool Feeling round Neck Pure Color,$1.43,0,China,//www.lazada.sg/products/pdp-i3463442106.html
🇸🇬RENZO Cooling T shirt Unisex Oversized Tshirt Tee Cotton Crew Neck Short Sleeve Men Women,$10.90,0,Singapore,//www.lazada.sg/products/pdp-i3274781180.html
Quick Dry Outdoor Sports T-Shirt round Neck Cool Sensation Sun Protection Breathable Sweat Absorbent Short Sleeve for Men And Women Fitness,$29.37,4800,China,//www.lazada.sg/products/pdp-i3459404564.html
Ice Silk Quick Dry Cool Feeling round Neck Short Sleeve T-Shirt Men's Half Sleeve Body Shirt Modal Cotton Summer Trend Pure Color,$7.41,212,China,//www.lazada.sg/products/pdp-i3422870609.html
🇸🇬RENZO Singlet Premium Cooling Sleeveless Tshirt Tank Top Unisex Men Women Sport Wear UV Protection,$10.90,0,Singapore,//www.lazada.sg/products/pdp-i3274369934.html
Ice Silk Men's Short Sleeve T-Shirt Breathable Cool Sensation Quick Dry Base Shirt Summer Thin Half Sleeve Youth Fashion round Neck,$3.11,0,China,//www.lazada.sg/products/pdp-i3463764152.html
Ice Silk Short Sleeve T-Shirt Men's Quick Dry Breathable Loose High Elasticity Running Mesh Sports Summer Fitness Clothes,$3.90,305,Hong Kong,//www.lazada.sg/products/pdp-i2873407423.html
Ice Silk Men's T-Shirt Short Sleeve Loose Fit Summer Cool Feeling Breathable Elastic Trendy Korean Style Casual Top Shirt,$3.30,12,China,//www.lazada.sg/products/pdp-i3429599476.html
Ice Silk Long Sleeve T-shirt for Men Lightweight Breathable Quick-drying Air Conditioning Indoor Outdoor Sun Protection Base Shirt,$3.38,4200,China,//www.lazada.sg/products/pdp-i3140784334.html
New 2024 round Neck Ice Silk Quick Dry Short Sleeve Men's T-Shirt Summer Thin Breathable Refreshing Casual Body Shirt,$3.13,9,China,//www.lazada.sg/products/pdp-i3407476351.html
Ice Silk Long Sleeve T-Shirt Men's Summer Thin Quick Dry Mesh Breathable Outdoor Sun Protection Air Conditioning Base Shirt,$3.12,366,China,//www.lazada.sg/products/pdp-i3440357371.html
Ice Silk Mesh Casual T-Shirt Short Sleeve Men's Top Breathable Sweat Absorbent Large Size Base Layer Shirt for Running in Summer,$2.01,8,China,//www.lazada.sg/products/pdp-i3414577096.html
Ice Cooling Original 300 + Summer Men Moisture Wicking Antibacterial Stretch Breathable Athleisure Short Sleeve T-shirt,$14.10,6,Hong Kong,//www.lazada.sg/products/pdp-i3170353890.html
Quick Dry Ice Silk Short Sleeve T-Shirt Unisex Running Fitness Hiking Summer Outdoor Sports Clothing Breathable Ultra Light UV Protection,$13.71,24,China,//www.lazada.sg/products/pdp-i3456935487.html
Ice Silk Thin Short Sleeve Hoodie Running T-Shirt Men's Summer Breathable Mesh Quick Dry Youth Fashion round Neck Casual Top,$3.31,12,China,//www.lazada.sg/products/pdp-i3463839044.html
Ice Silk Long Sleeve T-Shirt Men's Summer Thin Mesh Breathable Autumn Sunscreen Quick Dry Air Conditioning Base Shirt,$3.10,43,China,//www.lazada.sg/products/pdp-i3462801425.html
Ice Silk Long Sleeve T-Shirt Men's Summer Thin Mesh Breathable Sun Protection Quick Dry Outdoor Construction Base Shirt Air Conditioning Clothes,$2.37,602,China,//www.lazada.sg/products/pdp-i3445800698.html
Camouflage Ice Silk Mesh Short Sleeve T-Shirt Men's Summer Thin round Neck Sport Base Shirt Loose Fit Quick Dry Urban Fashion,$3.16,7,China,//www.lazada.sg/products/pdp-i3435276488.html
Semiconductor Cooling Workwear with 4 Fans Men's Summer Clothing Electric Welding Construction Site Work Uniform Breathable Long Sleeve Shirt,$37.38,1200,China,//www.lazada.sg/products/pdp-i3442666765.html
Ultra Cool Ice Silk Quick Dry Men's T-Shirt Thin Short Sleeve round Neck Running Fitness Sport Top Breathable Lightweight Summer Fashion Urban Style Polyester Spandex Blend,$14.29,24,China,//www.lazada.sg/products/pdp-i3316195681.html
Quick Dry Ice Silk Short Sleeve T-Shirt Men's Breathable Lightweight Summer Sport Shirt Half Sleeve Women's Outdoor Clothing,$5.18,96,China,//www.lazada.sg/products/pdp-i3446473281.html
Cool Cold Ice Silk Fabric! Quick-Drying Sun-Proof and Breathable! Men Athleisure Short Sleeve T-shirt Top 21739,$14.32,12,Hong Kong,//www.lazada.sg/products/pdp-i3171147743.html
Cool and Cool Japanese Milmumu Seamless Men Lightweight Goats 'Milk Ice Silk V Neck Short Sleeve T-shirt Pure Color Bottoming Shirt,$14.08,1200,China,//www.lazada.sg/products/pdp-i3113618600.html
Ice Silk Loose Short Sleeve T-Shirt round Neck Cotton Youth Summer New Style Men's Half Sleeve Shirt Cool Feeling Geometric Pattern,$3.01,30,China,//www.lazada.sg/products/pdp-i3464544677.html
UPF50 + Sun Protection Clothing Women's UV Protection Breathable Ice Silk Sun-Protective Clothing Men's Thin Outwear Summer Sun Protection Shirt Wind Shield,$10.64,12000,Hong Kong,//www.lazada.sg/products/pdp-i3121370458.html
Ice Silk Quick Dry Short Sleeve round Neck T-Shirt for Men Summer Sports Ice Sensation Youth Fashion Breathable Lightweight Casual Top,$3.12,29,China,//www.lazada.sg/products/pdp-i3434547005.html
2025 Summer New Men's Short Sleeve T-Shirt Zipper Decorated Quick Dry Sport Cool Feeling Stand Collar Half Zipper Top,$18.35,126,Hong Kong,//www.lazada.sg/products/pdp-i3462342962.html
Ice Silk Half Sleeve T-Shirt Quick Dry Breathable Base Layer Shirt for Sports Youthful Popular Loose Fit UV Protection,$3.31,99,China,//www.lazada.sg/products/pdp-i3435940175.html
Ice Silk Mesh Modal Cool Sensation Quick Dry Short Sleeve Men's T-Shirt Summer Sport Half Sleeve Top Trendy Fashion Sun Protection,$3.33,157,China,//www.lazada.sg/products/pdp-i3445118901.html
Men's Ice Silk Short Sleeve T-Shirt Loose Fit Modal Cool Feeling Cotton Half Sleeve Top Versatile Base Layer Shirt Youth Fashion,$3.12,42,China,//www.lazada.sg/products/pdp-i3437236875.html
Quick Dry Ice Silk Short Sleeve T Shirt Women Summer Loose Casual Versatile Cool Feeling Thin Body T-Shirt Pure Color Commute,$4.86,30,China,//www.lazada.sg/products/pdp-i3458972462.html
Men's Summer Short Sleeve T-Shirt Ice Silk Casual Loose Fit Quick Dry Body Shirt Breathable Cool Feeling Lightweight round Neck,$3.29,201,China,//www.lazada.sg/products/pdp-i3427577669.html
Ice Silk Quick Dry Short Sleeve Running Top Half Zipper Stand Collar Shark Sports T-Shirt Outdoor Summer Training Wear for Men,$3.40,363,China,//www.lazada.sg/products/pdp-i3436035724.html
Quick Dry Ice Silk Loose Casual Short Sleeve T-Shirt for Men Breathable Elastic Sports Top Summer Lightweight round Neck Tee,$3.11,112,China,//www.lazada.sg/products/pdp-i3439363222.html
Summer New Arrival K-style Silm Men Thin Short-Sleeved T-shirt Cool Ice Silk Non-Ironing Linen Bottoming Shirt Top Clothes,$2.61,101,Hong Kong,//www.lazada.sg/products/pdp-i3018173150.html
Buy One Get One Free Ice Silk Modal Cotton Short Sleeve T-Shirt Men Summer Cool Feeling Thin Base Shirt Solid Color Loose T,$2.34,868,Hong Kong,//www.lazada.sg/products/pdp-i3340139880.html
AOELEMENT Men's T-shirt Ice Silk Cool Breathable Gym Fitness Sport Undershirts Underwear 052,$4.96,78,China,//www.lazada.sg/products/pdp-i2030595308.html
Cooling Ice Silk Mesh T-Shirt Men's Summer Fitness Sport Wear Resistant Thin Short Sleeve Loose Fit Breathable round Neck Top,$22.32,6,China,//www.lazada.sg/products/pdp-i3461788725.html
Summer Thin Ice Silk Casual Men's Shirt Cool Short Sleeve Business Casual No Ironing Long Sleeve Standard Fit Square Collar,$8.22,0,China,//www.lazada.sg/products/pdp-i3465166887.html
Summer New Style Black Tech Workwear Cooling Air Conditioner Shirt Construction Fan Suit 200 Pounds Fan Integrated Clothing,$16.03,17,China,//www.lazada.sg/products/pdp-i3249670986.html
Cool Mesh Ice Silk Short Sleeve Polo Shirt Men's Button up Summer Solid Color Slip Material Half Sleeve Male T-Shirt Youth Fashion,$2.27,0,China,//www.lazada.sg/products/pdp-i3463757198.html
202401 Ice Silk Cool Sleeve T Men's Shirt Summer T-shirt New Arrival Boys White Short Color T-shirt Loose Half-Sleeve Top,$4.50,1000,China,//www.lazada.sg/products/pdp-i3140015182.html
Summer Ice Silk Cool Men's Short Sleeve Shirt Anti-Wrinkle No Ironing Business Formal White Shirt for Men Fashion Urban Style,$39.31,18,Hong Kong,//www.lazada.sg/products/pdp-i3435780626.html
Ice Silk Bamboo Mesh T-Shirt Men's Short Sleeve Quick-Drying Sweatshirts Half Sleeve Men's Summer Breathable Cool Feeling T-shirt Men's Top,$2.96,26,China,//www.lazada.sg/products/pdp-i3118002228.html
Men's Ice Silk Short Sleeve T-Shirt Loose Fit Base Layer Shirt Half Sleeve Cotton Modal Cool Feeling Casual round Neck Top,$2.48,3300,Hong Kong,//www.lazada.sg/products/pdp-i3341293723.html
High-End Linen Short-Sleeve T-Shirt Men's New Summer Trendy Brand Ice Silk Upper Body Cotton Linen Body Shirt Cool Feeling,$2.20,176,China,//www.lazada.sg/products/pdp-i3428395230.html
Ice Silk Mesh Quick Dry Short Sleeve T-Shirt Men Summer Cool Feeling round Neck Loose Breathable Fitness Running Clothing T,$3.27,4200,China,//www.lazada.sg/products/pdp-i3441936091.html
Sweat-Wicking Basic Pure Color T Summer Short Sleeve Last Generation Tops Shirt Cool Feeling Thin Quick-Drying Er Ice Silk Half Sleeve Men's,$3.52,1000,Hong Kong,//www.lazada.sg/products/pdp-i3029233423.html
Summer Men's Ice Silk Cool Feeling Loose Ultra-Thin Printed Half Sleeve Shirt Fashionable Youth Pop Style Short Sleeve Casual Shirt,$2.63,209,China,//www.lazada.sg/products/pdp-i3426567072.html
Ice Silk Mesh Modal Cool Sensation Quick Dry Short Sleeve T-Shirt Men Summer Sports Half Sleeve Top Trendy round Neck T-Shirt,$2.59,99,China,//www.lazada.sg/products/pdp-i3426459881.html
【Ship in 24H】High-end Jacquard Ice-feel Short Sleeve/M-5XL big size Ice silk cool shirt men simple plain Short Sleeve shirt plus size Casual loose冰丝短袖,$8.20,0,Singapore,//www.lazada.sg/products/pdp-i3389171086.html
HFA Cooling Quarter Zip Polo 220GSM Oversized Tee,$26.90,14,Singapore,//www.lazada.sg/products/pdp-i3434058756.html
Ice Silk Vest Men's Loose Lightweight Mesh Breathable Quick Dry Sports Base Shirt Sleeveless T-Shirt Summer Cool Feeling,$1.03,102,China,//www.lazada.sg/products/pdp-i3463632787.html
Ice Silk Men's Short Sleeve T-Shirt Ultra-Thin Quick-Drying Mesh Half Sleeve Cool Sensation Breathable Summer Fashion Tee Shirt,$2.34,16,China,//www.lazada.sg/products/pdp-i3423024766.html
Ice Silk Quick Dry Summer Thin Men's T-Shirt Outdoor Sports Shirt Cool Sensation Simple Match Large Size Casual round Neck Short Sleeve,$2.27,15,China,//www.lazada.sg/products/pdp-i3443970817.html
Ice Silk Men's Shirt Short Sleeve Lightweight Loose Fit Summer Casual Checkered Pattern Cool Feeling Trendy Brand Upperwear,$9.15,0,,//www.lazada.sg/products/pdp-i3442576946.html
Pemon Air Conditioning Suit Men's Fan Clothing Cooling Workwear Outdoor Heat Protection Shirt with Refrigeration Fan Summer,$27.28,3600,China,//www.lazada.sg/products/pdp-i3442187536.html
Cool Feeling Modal Short Sleeve T-Shirt Men's Summer Ice Silk round Neck Base Shirt Quick Dry Body Tee Youth Fashion Polyester Fiber,$4.79,478,Hong Kong,//www.lazada.sg/products/pdp-i3049480033.html
SHUNAICHI Summer short-sleeved shirt 2024 new fashion cool printed beach casual Hawaiian vacation trend men's cardigan top breathable,$10.84,0,China,//www.lazada.sg/products/pdp-i3460100149.html
Ice Silk Hollow out Short Sleeve Knitted Shirt Men's Summer Cool Quick Dry Casual Top Trendy High End Half Sleeve Knitwear,$2.70,0,China,//www.lazada.sg/products/pdp-i3452422439.html
Ice Silk Mesh Short Sleeve T-Shirt Men's Cool Feeling Summer Thin Breathable Quick Dry Large Size Sports Leisure Half Sleeve Body Shirt,$2.32,70,China,//www.lazada.sg/products/pdp-i3457862747.html
Modale Summer T-Shirt Men's Short Sleeve round Neck Base Shirt Cool Feeling Fashionable Casual Wear Youth Slim Fit No Ironing Required,$2.55,607,China,//www.lazada.sg/products/pdp-i3452544907.html
Ice Silk Quick Dry Cool Feeling Short Sleeve T-Shirt Men's round Neck Top Trendy Summer New Style Modal Cotton Half Sleeve Body Shirt,$3.12,6,China,//www.lazada.sg/products/pdp-i3435851884.html
Summer Thin Cotton Polo Shirt Men's Short Sleeve T-Shirt Pure Silk Ice Cool Collar Fashionable Youth Quick Dry Polyester Fiber,$3.11,6,China,//www.lazada.sg/products/pdp-i3461832582.html
Ice Silk Short Sleeve T-Shirt Men's Quick Dry Breathable Loose High Elasticity Running Mesh Sports Summer Fitness Clothes,$3.90,305,Hong Kong,//www.lazada.sg/products/pdp-i2873407423.html
Cool Feeling Ice Silk Men's T-Shirt Short Sleeve round Neck Summer Large Size Quick Dry Breathable Base Shirt Bamboo Node Mesh,$2.77,137,China,//www.lazada.sg/products/pdp-i3428391271.html
Ice Silk Thin Short Sleeve Men's T-Shirt Pure Color Summer Cool Inner Wear Sweat Shirt Half Sleeve T-Shirt Quick Dry Youth Fashion,$3.71,20,China,//www.lazada.sg/products/pdp-i3425471536.html
Ice Silk Half Sleeve T-Shirt Quick Dry Breathable Base Layer Shirt for Sports Youthful Popular Loose Fit UV Protection,$3.31,99,China,//www.lazada.sg/products/pdp-i3435940175.html
Men's Ice Silk Short Sleeve T-Shirt Loose Fit Modal Cool Feeling Cotton Half Sleeve Top Versatile Base Layer Shirt Youth Fashion,$3.12,42,China,//www.lazada.sg/products/pdp-i3437236875.html
Men's Summer Short Sleeve T-Shirt Ice Silk Casual Loose Fit Quick Dry Body Shirt Breathable Cool Feeling Lightweight round Neck,$3.29,201,China,//www.lazada.sg/products/pdp-i3427577669.html
Ice Silk Mesh Modal Cool Sensation Quick Dry Short Sleeve Men's T-Shirt Summer Sport Half Sleeve Top Trendy Fashion Sun Protection,$3.33,157,China,//www.lazada.sg/products/pdp-i3445118901.html
Ice Silk Quick Dry Short Sleeve Running Top Half Zipper Stand Collar Shark Sports T-Shirt Outdoor Summer Training Wear for Men,$3.40,363,China,//www.lazada.sg/products/pdp-i3436035724.html
Quick Dry Ice Silk Short Sleeve T Shirt Women Summer Loose Casual Versatile Cool Feeling Thin Body T-Shirt Pure Color Commute,$4.86,30,China,//www.lazada.sg/products/pdp-i3458972462.html
Summer New Arrival K-style Silm Men Thin Short-Sleeved T-shirt Cool Ice Silk Non-Ironing Linen Bottoming Shirt Top Clothes,$2.61,101,Hong Kong,//www.lazada.sg/products/pdp-i3018173150.html
Buy One Get One Free Ice Silk Modal Cotton Short Sleeve T-Shirt Men Summer Cool Feeling Thin Base Shirt Solid Color Loose T,$2.34,868,Hong Kong,//www.lazada.sg/products/pdp-i3340139880.html
Sweat-Wicking Basic Pure Color T Summer Short Sleeve Last Generation Tops Shirt Cool Feeling Thin Quick-Drying Er Ice Silk Half Sleeve Men's,$3.52,1000,Hong Kong,//www.lazada.sg/products/pdp-i3029233423.html
AOELEMENT Men's T-shirt Ice Silk Cool Breathable Gym Fitness Sport Undershirts Underwear 052,$4.96,78,China,//www.lazada.sg/products/pdp-i2030595308.html
Summer New Style Black Tech Workwear Cooling Air Conditioner Shirt Construction Fan Suit 200 Pounds Fan Integrated Clothing,$16.03,17,China,//www.lazada.sg/products/pdp-i3249670986.html
Men's Ice Silk Short Sleeve T-Shirt Loose Fit Base Layer Shirt Half Sleeve Cotton Modal Cool Feeling Casual round Neck Top,$2.48,3300,Hong Kong,//www.lazada.sg/products/pdp-i3341293723.html
202401 Ice Silk Cool Sleeve T Men's Shirt Summer T-shirt New Arrival Boys White Short Color T-shirt Loose Half-Sleeve Top,$4.50,1000,China,//www.lazada.sg/products/pdp-i3140015182.html
Cool Mesh Ice Silk Short Sleeve Polo Shirt Men's Button up Summer Solid Color Slip Material Half Sleeve Male T-Shirt Youth Fashion,$2.27,0,China,//www.lazada.sg/products/pdp-i3463757198.html
Ice Silk Bamboo Mesh T-Shirt Men's Short Sleeve Quick-Drying Sweatshirts Half Sleeve Men's Summer Breathable Cool Feeling T-shirt Men's Top,$2.96,26,China,//www.lazada.sg/products/pdp-i3118002228.html
High-End Linen Short-Sleeve T-Shirt Men's New Summer Trendy Brand Ice Silk Upper Body Cotton Linen Body Shirt Cool Feeling,$2.20,176,China,//www.lazada.sg/products/pdp-i3428395230.html
Ice Silk Mesh Quick Dry Short Sleeve T-Shirt Men Summer Cool Feeling round Neck Loose Breathable Fitness Running Clothing T,$3.27,4200,China,//www.lazada.sg/products/pdp-i3441936091.html
